{
  "id": "foundry-2024-001",
  "type": "foundry-release",
  "product": {
    "name": "Foundry Platform",
    "version": "2.5.0",
    "component": "Core Engine"
  },
  "status": "approved",
  "created_date": "2024-01-15T09:00:00Z",
  "scheduled_date": "2024-02-01T14:00:00Z",
  "title": "Foundry Platform v2.5.0 - Enhanced Performance and New Analytics",
  "summary": "This release introduces significant performance improvements and a new analytics dashboard. Users will experience faster load times and better insights into their data workflows.",
  "description": "Foundry Platform v2.5.0 brings major enhancements to core platform performance with up to 40% faster query execution. The new analytics dashboard provides real-time insights into data pipeline performance and resource utilization.",
  "changes": {
    "new_features": [
      {
        "name": "Real-time Analytics Dashboard",
        "description": "New dashboard providing insights into data pipeline performance, resource utilization, and query patterns",
        "impact": "Enables better monitoring and optimization of data workflows"
      },
      {
        "name": "Advanced Caching Layer",
        "description": "Intelligent caching system that learns from query patterns",
        "impact": "Up to 40% faster query execution for frequently accessed data"
      }
    ],
    "enhancements": [
      {
        "name": "Query Optimizer",
        "description": "Improved query optimization algorithms for complex joins and aggregations"
      },
      {
        "name": "UI Performance",
        "description": "Reduced initial load time by 25% through code optimization and lazy loading"
      }
    ],
    "bug_fixes": [
      {
        "issue": "Memory leak in long-running data pipelines",
        "resolution": "Fixed resource cleanup in pipeline executor"
      },
      {
        "issue": "Inconsistent date formatting in exports",
        "resolution": "Standardized date formatting to ISO 8601 across all export formats"
      }
    ],
    "breaking_changes": [],
    "deprecations": [
      {
        "feature": "Legacy API v1 endpoints",
        "reason": "Superseded by more efficient v2 endpoints",
        "alternative": "Migrate to API v2 endpoints (migration guide available)",
        "removal_date": "2024-06-01"
      }
    ],
    "security_updates": []
  },
  "stakeholders": {
    "owner": "Jane Smith",
    "product_manager": "John Doe",
    "engineering_lead": "Alice Johnson",
    "documentation_lead": "Bob Wilson",
    "reviewers": ["Carol White", "David Brown"]
  },
  "channels": {
    "foundry_release_notes": true,
    "devmicrosoft_changelog": true,
    "blog_post": true,
    "email_notification": true,
    "social_media": true,
    "documentation_update": true
  },
  "links": {
    "documentation": "https://docs.example.com/foundry/v2.5.0",
    "release_notes": "https://releases.example.com/foundry/2.5.0",
    "blog_post": "https://blog.example.com/foundry-2.5.0-release",
    "repository": "https://github.com/example/foundry"
  },
  "tags": ["performance", "analytics", "dashboard", "caching", "optimization"],
  "notes": "This release has been in beta for 4 weeks with positive feedback from early adopters."
}
